[
  {
    "id": "cronologia",
    "archivo": "escenas/explica.tsx",
    "exportacion": "Cronologia",
    "categoria": "timeline",
    "funcion": "Contar una secuencia de hechos en el tiempo, uno cae debajo del otro sobre una linea vertical.",
    "intensidad": 0.35,
    "ritmo": "dinamico",
    "capacidadTexto": "media",
    "requiereAssets": {"tipo": "ninguno", "obligatorio": false},
    "duracionMinMaxSeg": [4, 20],
    "compatibleCon": ["texto", "cifra"],
    "soportaAudioSincronizado": true,
    "props": {
      "titulo": "string, opcional",
      "hitos": "{cuando: string, que: string, acento?: boolean}[] -- un item por hito"
    },
    "estado": "validado",
    "notas": "Probado con audio real (patron AudioCentro de CasoGenerico.tsx): el bloque completo dura la suma de los clips de audio, pero el reparto visual interno entre hitos sigue siendo proporcional a 'dur' (durationInFrames), no exacto por hito. Rango de duracion escala con hitos.length (aprox 1.6-2s legibles por hito + intro)."
  },
  {
    "id": "lista-tachada",
    "archivo": "escenas/explica.tsx",
    "exportacion": "ListaTachada",
    "categoria": "lista",
    "funcion": "Mostrar varias opciones descartadas (se tachan) y una que 'queda' en pie -- alivio de 'no era vos, era el metodo'.",
    "intensidad": 0.5,
    "ritmo": "dinamico",
    "capacidadTexto": "media",
    "requiereAssets": {"tipo": "ninguno", "obligatorio": false},
    "duracionMinMaxSeg": [4, 15],
    "compatibleCon": ["texto", "cifra"],
    "soportaAudioSincronizado": true,
    "props": {
      "titulo": "string, opcional",
      "items": "string[] -- los que se tachan",
      "queda": "string -- el que queda en pie al final"
    },
    "estado": "validado",
    "notas": "Probado con audio real (AudioCentro). Igual limitacion que Cronologia: duracion total exacta, reparto interno proporcional."
  },
  {
    "id": "balanza",
    "archivo": "escenas/explica.tsx",
    "exportacion": "Balanza",
    "categoria": "comparacion",
    "funcion": "Comparar dos cosas por 'peso' sin usar un numero -- la barra se inclina hacia la que pesa mas.",
    "intensidad": 0.4,
    "ritmo": "dinamico",
    "capacidadTexto": "corta",
    "requiereAssets": {"tipo": "ninguno", "obligatorio": false},
    "duracionMinMaxSeg": [3, 8],
    "compatibleCon": ["texto"],
    "soportaAudioSincronizado": true,
    "props": {
      "titulo": "string, opcional",
      "izq": "{txt: string, peso: number}",
      "der": "{txt: string, peso: number}",
      "pie": "string, opcional -- remate final"
    },
    "estado": "validado",
    "notas": "Probado con audio real (AudioCentro). El angulo de inclinacion sale de (der.peso - izq.peso)/total -- son PESOS RELATIVOS, no hay que pasar numeros reales de dinero/cantidad aca."
  },
  {
    "id": "antes-despues",
    "archivo": "escenas/explica.tsx",
    "exportacion": "AntesDespues",
    "categoria": "comparacion",
    "funcion": "Cortina que cruza la pantalla y revela un 'despues' distinto del 'antes' -- el cambio se ve, no se cuenta.",
    "intensidad": 0.55,
    "ritmo": "dinamico",
    "capacidadTexto": "corta",
    "requiereAssets": {"tipo": "ninguno", "obligatorio": false},
    "duracionMinMaxSeg": [3, 10],
    "compatibleCon": ["texto"],
    "soportaAudioSincronizado": true,
    "props": {
      "antes": "{rotulo: string, txt: string}",
      "despues": "{rotulo: string, txt: string}"
    },
    "estado": "validado",
    "notas": "Probado con audio real (AudioCentro). El corte de cortina ocurre a dur*0.42..dur*0.62 fijo -- con audios muy distintos en duracion (antes largo, despues corto) el corte puede no caer justo cuando termina de hablarse 'antes'."
  },
  {
    "id": "pasos",
    "archivo": "escenas/explica.tsx",
    "exportacion": "Pasos",
    "categoria": "lista",
    "funcion": "Enumerar pasos de un metodo, uno debajo del otro con numero y dibujo -- lo mas simple y lo que mas se recuerda.",
    "intensidad": 0.3,
    "ritmo": "dinamico",
    "capacidadTexto": "media",
    "requiereAssets": {"tipo": "icono", "obligatorio": true},
    "duracionMinMaxSeg": [4, 20],
    "compatibleCon": ["texto", "diagrama"],
    "soportaAudioSincronizado": false,
    "props": {
      "titulo": "string, opcional",
      "pasos": "{fig: NombreFigura, txt: string}[] -- fig referencia un icono de dibujo/figuras.tsx"
    },
    "estado": "validado",
    "notas": "Nunca se probo con el patron AudioCentro (no se uso en la serie documental) -- debería aplicar igual que Cronologia/ListaTachada, pero no está confirmado. requiereAssets=icono porque cada paso NECESITA un NombreFigura valido de figuras.tsx, no un icono libre."
  },
  {
    "id": "contador",
    "archivo": "escenas/plata.tsx",
    "exportacion": "Contador",
    "categoria": "cifra",
    "funcion": "Numero grande que sube desde 0 (o desde un valor) hasta el valor final, con aterrizaje -- para cifras de impacto.",
    "intensidad": 0.7,
    "ritmo": "dinamico",
    "capacidadTexto": "corta",
    "requiereAssets": {"tipo": "ninguno", "obligatorio": false},
    "duracionMinMaxSeg": [2, 8],
    "compatibleCon": ["texto"],
    "soportaAudioSincronizado": true,
    "props": {
      "arriba": "string, opcional",
      "hasta": "number -- valor final",
      "abajo": "string, opcional",
      "prefijo": "string, default '$'",
      "sufijo": "string, opcional",
      "desde": "number, default 0"
    },
    "estado": "validado",
    "notas": "Probado con audio real (patron 'cifra.tipo===contador' en CasoGenerico.tsx): el conteo visual interno sigue su propia curva (dur*0.62), no está sincronizado palabra por palabra con el audio -- solo la DURACION TOTAL del bloque es exacta. El VALOR que se muestra (hasta) debe venir ya resuelto por fabrica/voz/normalizador.py (normalizar_numero/normalizar_dinero) antes de llegar aca -- este componente no normaliza nada."
  },
  {
    "id": "cifra-se-cae",
    "archivo": "escenas/mas.tsx",
    "exportacion": "CifraSeCae",
    "categoria": "cifra",
    "funcion": "Un numero grande se desploma y rota, y abajo aparece el numero chico que lo reemplaza -- la sensacion de perder, dibujada.",
    "intensidad": 0.75,
    "ritmo": "dinamico",
    "capacidadTexto": "corta",
    "requiereAssets": {"tipo": "ninguno", "obligatorio": false},
    "duracionMinMaxSeg": [3, 8],
    "compatibleCon": ["texto"],
    "soportaAudioSincronizado": true,
    "props": {
      "arriba": "string, opcional",
      "de": "string -- el valor que se cae (ya como texto_visual)",
      "a": "string -- el valor que reemplaza (ya como texto_visual)",
      "abajo": "string, opcional"
    },
    "estado": "validado",
    "notas": "Probado con audio real. 'de'/'a' son STRINGS ya formateados (ej. '$4.699'), no numbers -- vienen de normalizar_dinero(...).texto_visual."
  },
  {
    "id": "reloj-que-corre",
    "archivo": "escenas/mas.tsx",
    "exportacion": "RelojQueCorre",
    "categoria": "cuenta_regresiva",
    "funcion": "Numero que baja (o sube) hasta un valor, con textura de urgencia -- genera 'no puedo irme hasta ver en cuanto termina'.",
    "intensidad": 0.65,
    "ritmo": "dinamico",
    "capacidadTexto": "corta",
    "requiereAssets": {"tipo": "ninguno", "obligatorio": false},
    "duracionMinMaxSeg": [3, 10],
    "compatibleCon": ["texto"],
    "soportaAudioSincronizado": false,
    "props": {
      "arriba": "string",
      "desde": "number",
      "hasta": "number, default 0",
      "abajo": "string, opcional",
      "unidad": "string, opcional (ej. 's', '%')"
    },
    "estado": "validado",
    "notas": "Nunca probado con audio sincronizado -- no se uso en la serie documental."
  },
  {
    "id": "embudo",
    "archivo": "escenas/mas.tsx",
    "exportacion": "Embudo",
    "categoria": "comparacion",
    "funcion": "Barras que se angostan de arriba a abajo -- de cien arrancan, uno llega.",
    "intensidad": 0.45,
    "ritmo": "dinamico",
    "capacidadTexto": "media",
    "requiereAssets": {"tipo": "ninguno", "obligatorio": false},
    "duracionMinMaxSeg": [4, 15],
    "compatibleCon": ["texto", "cifra"],
    "soportaAudioSincronizado": false,
    "props": {
      "titulo": "string, opcional",
      "pisos": "{txt: string, cuantos: string}[]",
      "pie": "string, opcional"
    },
    "estado": "validado",
    "notas": "Nunca probado con audio sincronizado."
  },
  {
    "id": "encuesta",
    "archivo": "escenas/mas.tsx",
    "exportacion": "Encuesta",
    "categoria": "encuesta",
    "funcion": "Pregunta con dos opciones y barras de porcentaje que se revelan -- el que mira contesta en la cabeza antes de ver el resultado.",
    "intensidad": 0.5,
    "ritmo": "dinamico",
    "capacidadTexto": "media",
    "requiereAssets": {"tipo": "ninguno", "obligatorio": false},
    "duracionMinMaxSeg": [3, 8],
    "compatibleCon": ["texto"],
    "soportaAudioSincronizado": false,
    "props": {
      "pregunta": "string",
      "a": "{txt: string, pct: number}",
      "b": "{txt: string, pct: number}",
      "remate": "string, opcional"
    },
    "estado": "validado",
    "notas": "pct debe venir de normalizar_porcentaje(...).valor si se narra en voz alta, para que lo hablado y lo mostrado coincidan. Nunca probado con audio sincronizado."
  },
  {
    "id": "tres-verdades",
    "archivo": "escenas/mas.tsx",
    "exportacion": "TresVerdades",
    "categoria": "texto",
    "funcion": "Frases cortas, una tapa a la otra, pantalla llena -- puro ritmo, sin nada mas.",
    "intensidad": 0.6,
    "ritmo": "muy_dinamico",
    "capacidadTexto": "corta",
    "requiereAssets": {"tipo": "ninguno", "obligatorio": false},
    "duracionMinMaxSeg": [3, 15],
    "compatibleCon": [],
    "soportaAudioSincronizado": false,
    "props": {
      "frases": "string[]"
    },
    "estado": "validado",
    "notas": "El reparto es EQUITATIVO entre frases (dur/frases.length) -- si las frases tienen audio de duracion muy distinta, este componente no es el correcto sin antes adaptarlo (ver Secuencia en CasoGenerico.tsx, que sí reparte por duracion real)."
  },
  {